{
  "$schema": "https://json-schema.org/draft/2020-12/schema",
  "title": "OMX benchmark result",
  "type": "object",
  "required": [
    "variant",
    "experiment_slug",
    "base_ref",
    "harness_branch",
    "branch_name",
    "token_source"
  ],
  "properties": {
    "variant": {
      "type": "string",
      "enum": [
        "baseline",
        "with-omx"
      ]
    },
    "experiment_slug": {
      "type": "string"
    },
    "base_ref": {
      "type": "string"
    },
    "harness_branch": {
      "type": "string"
    },
    "branch_name": {
      "type": "string"
    },
    "token_source": {
      "type": "string"
    },
    "tasks_total": {
      "type": [
        "integer",
        "null"
      ],
      "minimum": 0
    },
    "tasks_succeeded": {
      "type": [
        "integer",
        "null"
      ],
      "minimum": 0
    },
    "tests_passed": {
      "type": [
        "integer",
        "null"
      ],
      "minimum": 0
    },
    "tests_total": {
      "type": [
        "integer",
        "null"
      ],
      "minimum": 0
    },
    "input_tokens": {
      "type": [
        "integer",
        "null"
      ],
      "minimum": 0
    },
    "output_tokens": {
      "type": [
        "integer",
        "null"
      ],
      "minimum": 0
    },
    "total_tokens": {
      "type": [
        "integer",
        "null"
      ],
      "minimum": 0
    },
    "wall_clock_minutes": {
      "type": [
        "number",
        "null"
      ],
      "minimum": 0
    },
    "turn_count": {
      "type": [
        "integer",
        "null"
      ],
      "minimum": 0
    },
    "tool_call_count": {
      "type": [
        "integer",
        "null"
      ],
      "minimum": 0
    },
    "files_changed": {
      "type": [
        "integer",
        "null"
      ],
      "minimum": 0
    },
    "lines_added": {
      "type": [
        "integer",
        "null"
      ],
      "minimum": 0
    },
    "lines_deleted": {
      "type": [
        "integer",
        "null"
      ],
      "minimum": 0
    },
    "verification_commands": {
      "type": "array",
      "items": {
        "type": "string"
      }
    },
    "qualitative_notes": {
      "type": "array",
      "items": {
        "type": "string"
      }
    }
  },
  "additionalProperties": false
}
